{
  "source_id": "src_campus_gps_1",
  "source_type": "telemetry_feed",
  "name": "Campus GPS Feed 1",
  "status": "active",
  "owner": "campus-operations",
  "auth_ref": "secret://sources/campus-gps-1",
  "polling_mode": "push",
  "schema_version": "1.0.0",
  "created_at": "2026-04-05T00:00:00Z",
  "updated_at": "2026-04-05T00:00:00Z"
}
